place,title,time,pay,date
부산 중구, ABC MART,시간협의,"월급1,822,480",31분전
서울 노원구, ABC MART,시간협의,"월급1,822,480",1시간전
서울 노원구, ABC MART,시간협의,"월급732,480",1시간전
울산 중구, ABC MART,시간협의,"월급732,480",2시간전
울산 남구, ABC MART,시간협의,"월급732,480",2시간전
경남 창원시, ABC MART,시간협의,"월급1,822,480",3시간전
경남 진주시, ABC MART,시간협의,"월급1,822,480",6시간전
전남 순천시, ABC MART,시간협의,"월급732,488",10시간전
부산 북구, ABC MART,시간협의,"월급732,480",01/31
부산 해운대, ABC MART,시간협의,"월급732,480",01/30
전남 광양시, ABC MART,시간협의,"월급1,822,480",01/30
전남 무안군, ABC MART,시간협의,"월급1,822,480",01/30
광주 서구, ABC MART,시간협의,"월급1,822,480",01/30
광주 광산구, ABC MART,시간협의,"월급1,822,480",01/30
전북 전주시, ABC MART,시간협의,"월급732,480",01/30
전남 여수시, ABC MART,시간협의,"월급1,822,480",01/29
울산 북구, ABC MART,시간협의,"월급732,480",01/29
전남 여수시, ABC MART,시간협의,"월급732,480",01/29
전북 익산시, ABC MART,시간협의,"월급1,822,480",01/25
서울 강서구, ABC MART,시간협의,"월급1,822,480",01/25
경기 고양시, ABC MART,시간협의,"월급1,822,480",01/24
광주 서구, ABC MART,시간협의,"월급1,822,480",01/23
경기 고양시, ABC MART,시간협의,"월급732,480",01/17
경기 고양시, ABC MART,시간협의,"월급1,822,480",01/17
경북 경주시, ABC MART,시간협의,"월급1,822,480",01/16
